{
  "schema_version": "2.0",
  "currency": "TND",
  "producer": {
    "name": "Coopérative des Grandes Cultures du Nord-Ouest",
    "region": "Béja",
    "country": "Tunisia",
    "latitude": null,
    "longitude": null,
    "farm_size_ha": null
  },
  "crops": [
    {
      "id": "durum_wheat",
      "name": "durum_wheat",
      "variety": "Karim",
      "type": "durable",
      "unit": "kg",
      "reference_price_per_kg": 1.4075,
      "shelf_life_ambient_days": 360,
      "shelf_life_cold_days": null,
      "quality_decay_pct_per_day": 0.0,
      "loss_rate_pct_per_day_ambient": 0.02,
      "loss_rate_pct_per_day_cold": null,
      "requires_cold_chain": false
    }
  ],
  "harvest_lots": [
    {
      "id": "wheat_main",
      "crop_id": "durum_wheat",
      "quantity_kg": 20000.0,
      "available_day": 0,
      "quality_grade": null
    },
    {
      "id": "wheat_late",
      "crop_id": "durum_wheat",
      "quantity_kg": 10000.0,
      "available_day": 7,
      "quality_grade": null
    }
  ],
  "buyers": [
    {
      "id": "buyer_tn_w01",
      "name": "Office des Céréales - Silo Béja",
      "location": "Béja",
      "crop_ids": [
        "durum_wheat"
      ],
      "price_per_kg": 1.3,
      "price_schedule": null,
      "max_demand_kg": 15000.0,
      "max_per_day_kg": null,
      "min_contract_kg": 5000.0,
      "min_order_kg": null,
      "window_start_day": null,
      "window_end_day": null,
      "requires_cold_chain": false,
      "payment_terms_days": null,
      "priority": "contract"
    },
    {
      "id": "buyer_tn_w02",
      "name": "Minoterie des Grands Moulins Tunis",
      "location": "Tunis",
      "crop_ids": [
        "durum_wheat"
      ],
      "price_per_kg": 1.45,
      "price_schedule": [
        {
          "day": 20,
          "price": 1.55
        }
      ],
      "max_demand_kg": 12000.0,
      "max_per_day_kg": null,
      "min_contract_kg": null,
      "min_order_kg": null,
      "window_start_day": null,
      "window_end_day": null,
      "requires_cold_chain": false,
      "payment_terms_days": null,
      "priority": "spot"
    },
    {
      "id": "buyer_tn_w03",
      "name": "Semoulerie du Nord Mateur",
      "location": "Mateur",
      "crop_ids": [
        "durum_wheat"
      ],
      "price_per_kg": 1.38,
      "price_schedule": null,
      "max_demand_kg": 8000.0,
      "max_per_day_kg": null,
      "min_contract_kg": null,
      "min_order_kg": null,
      "window_start_day": null,
      "window_end_day": null,
      "requires_cold_chain": false,
      "payment_terms_days": null,
      "priority": "spot"
    },
    {
      "id": "buyer_tn_w04",
      "name": "Fabrique de Pâtes Alimentaires Sousse",
      "location": "Sousse",
      "crop_ids": [
        "durum_wheat"
      ],
      "price_per_kg": 1.5,
      "price_schedule": null,
      "max_demand_kg": 6000.0,
      "max_per_day_kg": null,
      "min_contract_kg": null,
      "min_order_kg": null,
      "window_start_day": null,
      "window_end_day": null,
      "requires_cold_chain": false,
      "payment_terms_days": null,
      "priority": "spot"
    }
  ],
  "storage_facilities": [
    {
      "id": "silo_beja",
      "name": "Silo Béja",
      "capacity_kg": 15000.0,
      "refrigerated": false,
      "cost_per_kg_per_day": 0.008
    }
  ],
  "vehicle_types": [
    {
      "id": "truck_8t",
      "name": "Camion benne 8 t",
      "capacity_kg": 8000.0,
      "count": 4,
      "refrigerated": false,
      "fixed_cost_per_trip": 50.0,
      "cost_per_km": 1.4,
      "avg_speed_kmh": 60.0,
      "hours_per_day": 12.0,
      "loading_hours_per_trip": 1.5,
      "max_trips_per_day": null
    }
  ],
  "routes": [
    {
      "buyer_id": "buyer_tn_w01",
      "distance_km": 12.0,
      "road_condition": "good",
      "road_factor_override": null,
      "legacy_cost_per_kg_per_km": null,
      "toll_per_trip": null
    },
    {
      "buyer_id": "buyer_tn_w02",
      "distance_km": 105.0,
      "road_condition": "good",
      "road_factor_override": null,
      "legacy_cost_per_kg_per_km": null,
      "toll_per_trip": null
    },
    {
      "buyer_id": "buyer_tn_w03",
      "distance_km": 60.0,
      "road_condition": "good",
      "road_factor_override": null,
      "legacy_cost_per_kg_per_km": null,
      "toll_per_trip": null
    },
    {
      "buyer_id": "buyer_tn_w04",
      "distance_km": 210.0,
      "road_condition": "good",
      "road_factor_override": null,
      "legacy_cost_per_kg_per_km": null,
      "toll_per_trip": null
    }
  ]
}
