{
  "schema_version": "2.0",
  "currency": "TND",
  "producer": {
    "name": "Coopérative Maraîchère El Alem",
    "region": "Kairouan",
    "country": "Tunisia",
    "latitude": null,
    "longitude": null,
    "farm_size_ha": null
  },
  "crops": [
    {
      "id": "tomatoes",
      "name": "tomatoes",
      "variety": "Rio Grande",
      "type": "perishable",
      "unit": "kg",
      "reference_price_per_kg": 0.975,
      "shelf_life_ambient_days": 8,
      "shelf_life_cold_days": 14,
      "quality_decay_pct_per_day": 3.0,
      "loss_rate_pct_per_day_ambient": 2.0,
      "loss_rate_pct_per_day_cold": 0.5,
      "requires_cold_chain": true
    }
  ],
  "harvest_lots": [
    {
      "id": "tomatoes_pick1",
      "crop_id": "tomatoes",
      "quantity_kg": 5000.0,
      "available_day": 0,
      "quality_grade": null
    },
    {
      "id": "tomatoes_pick2",
      "crop_id": "tomatoes",
      "quantity_kg": 5000.0,
      "available_day": 3,
      "quality_grade": null
    },
    {
      "id": "tomatoes_pick3",
      "crop_id": "tomatoes",
      "quantity_kg": 4000.0,
      "available_day": 6,
      "quality_grade": null
    }
  ],
  "buyers": [
    {
      "id": "buyer_tn_t01",
      "name": "Conserverie Double Concentré Kairouan",
      "location": "Kairouan",
      "crop_ids": [
        "tomatoes"
      ],
      "price_per_kg": 0.45,
      "price_schedule": null,
      "max_demand_kg": 7000.0,
      "max_per_day_kg": null,
      "min_contract_kg": null,
      "min_order_kg": null,
      "window_start_day": null,
      "window_end_day": null,
      "requires_cold_chain": false,
      "payment_terms_days": null,
      "priority": "spot"
    },
    {
      "id": "buyer_tn_t02",
      "name": "Marché de Gros Bir El Kassâa",
      "location": "Tunis",
      "crop_ids": [
        "tomatoes"
      ],
      "price_per_kg": 1.1,
      "price_schedule": null,
      "max_demand_kg": 4500.0,
      "max_per_day_kg": 1500.0,
      "min_contract_kg": null,
      "min_order_kg": null,
      "window_start_day": null,
      "window_end_day": null,
      "requires_cold_chain": false,
      "payment_terms_days": null,
      "priority": "spot"
    },
    {
      "id": "buyer_tn_t03",
      "name": "Marché de Gros Sousse",
      "location": "Sousse",
      "crop_ids": [
        "tomatoes"
      ],
      "price_per_kg": 0.95,
      "price_schedule": null,
      "max_demand_kg": 3500.0,
      "max_per_day_kg": null,
      "min_contract_kg": null,
      "min_order_kg": null,
      "window_start_day": null,
      "window_end_day": null,
      "requires_cold_chain": false,
      "payment_terms_days": null,
      "priority": "spot"
    },
    {
      "id": "buyer_tn_t04",
      "name": "Exportateur Primeurs Sahel",
      "location": "Monastir",
      "crop_ids": [
        "tomatoes"
      ],
      "price_per_kg": 1.4,
      "price_schedule": null,
      "max_demand_kg": 2500.0,
      "max_per_day_kg": 800.0,
      "min_contract_kg": null,
      "min_order_kg": null,
      "window_start_day": 2,
      "window_end_day": null,
      "requires_cold_chain": false,
      "payment_terms_days": null,
      "priority": "spot"
    }
  ],
  "storage_facilities": [
    {
      "id": "cold_room_kairouan",
      "name": "Chambre froide Kairouan",
      "capacity_kg": 2500.0,
      "refrigerated": true,
      "cost_per_kg_per_day": 0.05
    }
  ],
  "vehicle_types": [
    {
      "id": "reefer_3_5t",
      "name": "Camion frigorifique 3,5 t",
      "capacity_kg": 3500.0,
      "count": 3,
      "refrigerated": true,
      "fixed_cost_per_trip": 50.0,
      "cost_per_km": 1.3,
      "avg_speed_kmh": 60.0,
      "hours_per_day": 12.0,
      "loading_hours_per_trip": 1.0,
      "max_trips_per_day": null
    }
  ],
  "routes": [
    {
      "buyer_id": "buyer_tn_t01",
      "distance_km": 18.0,
      "road_condition": "fair",
      "road_factor_override": null,
      "legacy_cost_per_kg_per_km": null,
      "toll_per_trip": null
    },
    {
      "buyer_id": "buyer_tn_t02",
      "distance_km": 160.0,
      "road_condition": "fair",
      "road_factor_override": null,
      "legacy_cost_per_kg_per_km": null,
      "toll_per_trip": null
    },
    {
      "buyer_id": "buyer_tn_t03",
      "distance_km": 65.0,
      "road_condition": "fair",
      "road_factor_override": null,
      "legacy_cost_per_kg_per_km": null,
      "toll_per_trip": null
    },
    {
      "buyer_id": "buyer_tn_t04",
      "distance_km": 85.0,
      "road_condition": "fair",
      "road_factor_override": null,
      "legacy_cost_per_kg_per_km": null,
      "toll_per_trip": null
    }
  ]
}
